{
  "manifest_blake3": "aaaaaaaaaaaaaaaaaaaaaaaaaaaaaaaaaaaaaaaaaaaaaaaaaaaaaaaaaaaaaaaa",
  "ready_class": "ready",
  "missing_records": [],
  "stale_records": [],
  "unsupported_records": [],
  "untrusted_records": [],
  "non_claim": "source bundle evidence proves declared source/input availability and identity only"
}
